label-coarse,text
OTHERS,How did serfdom develop in and then leave Russia ?
1,What films featured the character Popeye Doyle ?
OTHERS,How can I find a list of celebrities ' real names ?
1,What fowl grabs the spotlight after the Chinese Year of the Monkey ?
2,What is the full form of .com ?
OTHERS,What contemptible scoundrel stole the cork from my lunch ?
OTHERS,What team did baseball 's St. Louis Browns become ?
OTHERS,What is the oldest profession ?
OTHERS,Name the scar-faced bounty hunter of The Old West .
4,When was Ozzy Osbourne born ?
OTHERS,Why do heavier objects travel downhill faster ?
OTHERS,Who was The Pride of the Yankees ?
OTHERS,Who killed Gandhi ?
1,What is considered the costliest disaster the insurance industry has ever faced ?
OTHERS,What did the only repealed amendment to the U.S. Constitution deal with ?
4,How many Jews were executed in concentration camps during WWII ?
OTHERS,What is `` Nine Inch Nails '' ?
OTHERS,What is an annotated bibliography ?
4,What is the date of Boxing Day ?
1,What articles of clothing are tokens in Monopoly ?
OTHERS,Name 11 famous martyrs .
OTHERS,What is the origin of the name ` Scarlett ' ?
1,What 's the second-most-used vowel in English ?
OTHERS,Who was the inventor of silly putty ?
5,What is the highest waterfall in the United States ?
1,Name a golf course in Myrtle Beach .
2,What does the abbreviation AIDS stand for ?
1,What does a spermologer collect ?
4,How many points make up a perfect fivepin bowling score ?
4,How many Community Chest cards are there in Monopoly ?
OTHERS,What do Mormons believe ?
4,When did the neanderthal man live ?
1,In what religion was Isis the nature goddess ?
5,Where do the adventures of `` The Swiss Family Robinson '' take place ?
1,What relative of the racoon is sometimes known as the cat-bear ?
OTHERS,How can I register my website in Yahoo for free ?
1,What was cash-conscious Colonel Edwin L. Drake the first to drill ?
4,How many people in the world speak French ?
4,How many inches over six feet is the Venus de Milo ?
OTHERS,How do they find or choose witnesses to an execution ?
OTHERS,What 1920s cowboy star rode Tony the Wonder Horse ?
1,What cocktail inspired John Doxat to write the book Stirred-Not Shaken ?
OTHERS,What ISPs exist in the Caribbean ?
OTHERS,How do you ask a total stranger out on a date ?
1,What weapon is the mythological character Apollo most proficient with ?
5,What country do the Galapagos Islands belong to ?
OTHERS,What is ethology ?
OTHERS,Who was the prophet of the Muslim people ?
OTHERS,Where did the term `` 86ed '' come from ?
OTHERS,Who is Snoopy 's arch-enemy ?
OTHERS,What is the nature of learning ?
1,What 's the only color Johnny Cash wears on stage ?
1,What 's the term for a young fox ?
5,What U.S. state lived under six flags ?
OTHERS,What is the Kashmir issue ?
5,Where is the Loop ?
OTHERS,What does `` extended definition '' mean and how would one write a paper on it ?
5,What country 's capital is Tirana ?
OTHERS,What is titanium ?
OTHERS,Who do Herb and Tootsie live next door to ?
OTHERS,What is a caldera ?
OTHERS,Why do people get calluses ?
5,What are the names of the tourist attractions in Reims ?
OTHERS,What are Cushman and Wakefield known for ?
5,What body of water does the Danube River flow into ?
OTHERS,Who is the founder of Scientology ?
1,What does the six-footed Musca domestica become when it enters a house ?
OTHERS,What is the history of skateboarding ?
OTHERS,Who starred in Singing in the Rain and The Singing Nun ?
OTHERS,How do I make fuel bricks from recycled newspaper ?
OTHERS,What 19th-century painter died in the Marquesas Islands ?
1,The corpus callosum is in what part of the body ?
OTHERS,How do I log on to home page at Headquarters U.S. European Command ?
4,How many species of the Great White shark are there ?
OTHERS,What is the origin of head lice ?
5,What is the nickname for the state of Mississippi ?
4,How many villi are found in the small intestine ?
5,What country did King Wenceslas rule ?
1,What is a fear of shadows ?
OTHERS,Who were the five Marx brothers ?
4,In which year was New Zealand excluded from the ANZUS alliance ?
4,When did CNN begin broadcasting ?
OTHERS,What causes the body to shiver in cold temperatures ?
OTHERS,What are bear and bull markets ?
1,What J.R.R. Tolkien book features Bilbo Baggins as the central character ?
OTHERS,What is `` dew point '' ?
OTHERS,What is the meaning of Jesus ?
OTHERS,What company 's logo is a `` W '' in a circle ?
OTHERS,What is the definition of a cascade ?
4,When did Rococo painting and architecture flourish ?
5,What country 's national passenger rail system is called Via ?
OTHERS,Who invented Make-up ?
OTHERS,What is the origin of the word `` attic '' ?
1,What kind of animals were in the Paleozoic era ?
OTHERS,Which of the following was Rhodes Scholar ?
OTHERS,Who comprised the now-defunct comic book team known as the Champions ?
1,What is a female rabbit called ?
5,Where is the highest point in Japan ?
OTHERS,Where do chihuahuas come from ?
5,Where does Barney Rubble go to work after he drops Fred off in the `` Flintstones '' cartoon series ?
5,What are the world 's four oceans ?
1,What 's the only work by Michelangelo that bears his signature ?
1,What is the largest snake in the world ?
1,In what medium is Stuart Hamblen considered to be the first singing cowboy ?
5,Where on the Internet can I find a song lyrics database similar to the International Lyrics Server ?
4,How much money does a back injury lawsuit get ?
1,What 's the common name for acetylsalicylic acid ?
OTHERS,What does the Georgetown `` Hoya '' mean ?
5,Where can I find a list of `` classic '' books 5th and 6th graders should read ?
1,Which two products use a tiger as their symbol ?
OTHERS,How is the election of a new Pope announced to the world ?
4,How long does it take for your blood to make one complete trip through the body ?
OTHERS,How do chickens have baby chicks ?
OTHERS,What is the historical relationship of Catholic Church and bingo ?
OTHERS,How was the element calcium named ?
OTHERS,What crooner joined The Andrews Sisters for Pistol Packin Mama ?
OTHERS,What piano company claims its product is the `` Instrument of the immortals '' ?
4,When did the Bounty mutiny take place ?
1,What novel inspired the movie BladeRunner ?
OTHERS,What is a transistor ?
1,What Hollywood dog died in the arms of Jean Harlow in 1932 ?
1,What are the most common elements in the Earth 's crust ?
4,"How much would it cost to purchase a 2-foot-square party tent , with sides , ?"
OTHERS,What actress has received the most Oscar nominations ?
OTHERS,What are equity securities ?
OTHERS,What is gymnophobia ?
4,How many years do fossils take to form ?
5,Where is the Orinoco ?
1,What was the name of the `` Little Rascals '' dog ?
5,"What city boasts Penn 's Landing , on the banks of the Delaware river ?"
1,What Broadway musical was inspired by Cervantes 's Don Quixote ?
OTHERS,"What is the origin of the word , JJ ."
4,How many hostages were killed in the Entebbe raid ?
OTHERS,How you can raise your IQ ?
2,What does INRI stand for when used on Jesus ' cross ?
OTHERS,Who produces Spumante ?
OTHERS,Who earns their money the hard way ?
OTHERS,Who founded the People 's Temple Commune ?
4,How many bends are there in a standard paper clip ?
OTHERS,Who discovered electricity ?
1,What part of your body contains the corpus callosum ?
OTHERS,Who was the first American in space ?
5,What two South American countries do n't border Brazil ?
1,"What poem contains the line , `` grow old with me the best is yet to be '' ."
OTHERS,What is a dental root canal ?
1,What war did the Wanna-Go-Home Riots occur after ?
4,What is the busiest air travel season ?
1,What 's the colored part of the eye called ?
OTHERS,What are hook worms ?
5,Where is the Rose Bowl played ?
OTHERS,Which Japanese car maker had its biggest percentage of sale in the domestic market ?
OTHERS,Who is the mayor of Marbella ?
4,How many months does it take the moon to revolve around the Earth ?
5,Where are the 49 steps ?
4,In what year was De Gaulle elected president of France ?
OTHERS,Who sings the themes for `` Dawson 's Creek '' and `` Felicity '' ?
OTHERS,Who directed `` Jaws '' ?
1,On what T.V. show could Tom Terrific be found ?
OTHERS,What Indian tribe is F Troop perpetually doing battle with ?
OTHERS,Where did Indian Pudding come from ?
OTHERS,Why do some clothing labels say `` Use a nonchlorine bleach '' ?
4,How many colonies were involved in the American Revolution ?
5,Where can I find pictorial directions on how to build a very simple treehouse ?
1,"What game 's board shows the territories of Irkutsk , Yakutsk and Kamchatka ?"
OTHERS,What is the name of the managing director of Apricot Computer ?
OTHERS,What is the occupation of Nicholas Cage ?
OTHERS,Why do horseshoes bring luck ?
OTHERS,"What is the 401 , K , plan ?"
OTHERS,What causes pneumonia ?
4,What are the three winter months in the southern hemisphere ?
OTHERS,What does gringo mean ?
5,What country contains Africa 's northernmost point ?
1,What therapy attempts to elicit the `` primal scream '' ?
5,Where is the Kalahari desert ?
OTHERS,Which Ventura County police department seized the largest cocaine shipment in it 's history ?
5,What city is sometimes called Gotham ?
1,What dangles over the tongue from the palate ?
OTHERS,Who created Dennis the Menace ?
OTHERS,What dummy received an honorary degree from Northwestern University ?
4,When was the first Wall Street Journal published ?
5,What countries have the largest areas of forest ?
OTHERS,Name Alvin 's brothers
OTHERS,What is Eagle 's syndrome styloid process ?
OTHERS,How did Jayne Mansfield die ?
4,When did the royal wedding of Prince Andrew and Fergie take place ?
OTHERS,What actor said in A Day at the Races : `` Either he 's dead or my watch has stopped '' ?
OTHERS,What explorer was nicknamed Iberia 's Pilot ?
4,CNN began broadcasting in what year ?
1,What is a ball that hits the foul pole called ?
OTHERS,What makes hamburgers taste like steakburgers ?
OTHERS,Which company created the Internet browser Mosaic ?
1,What are the rites accompanying the circumcision of a newly born-child in Judaism called ?
1,What was the education system in the 1960 's ?
5,What South American city has the world 's highest commercial landing field ?
OTHERS,How can I find out which cities have cable-modem access ?
OTHERS,What is Betsy Ross famous for ?
4,How many species of sharks are there ?
OTHERS,What is `` snoogans '' ?
4,How many people are there in the world ?
1,What shrubs can be planted that will be safe from deer ?
OTHERS,What organization 's offices were broken into at Watergate in 1972 ?
OTHERS,What is the design of the ship Titanic ?
2,What does S.O.S. stand for ?
1,Name a technique widely used to detect birth defects ?
OTHERS,What is the daily requirement of folic acid for an expectant mother ?
OTHERS,What is the `` 7-minute cigarette '' ?
1,What four forms does gold occur in ?
4,What is the acreage of the Chappellet vineyard ?
4,When did beethoven die ?
4,How much does a new railroad coal car cost ?
OTHERS,What is the filmmakers collabrative ?
OTHERS,What Russian composer 's Prelude in C Sharp Minor brought him fame and fortune ?
OTHERS,What caused Harry Houdini 's death ?
OTHERS,"Who was the mother of the man who would not be king , the duke of Windsor ?"
4,How many revolutions does a standard LP make in three minutes ?
5,What is the name of the tallest mountain in the world ?
5,Where can I find a review of Nightmare on Elm Street in a film journal ?
1,What 's the slowest Olympic swimming stroke ?
1,What rum is so `` mixable '' it is a one-brand bar ?
4,How many South American countries have the letter Z in their names ?
OTHERS,What is the contents of proposition 98 ?
5,Where was George Washington born ?
OTHERS,Who wrote NN DT NNP NNP '' ?
OTHERS,What is paracetamol ?
1,"Which mosquito 's bite draws blood , DT NN CC DT NN ."
4,When was the first steel mill in the United States built ?
OTHERS,What is the origin of the name Katie ?
OTHERS,"What schools in the Washington , DC NN NN VBP NN NN NN NN ."
4,When did the Berlin Wall go up ?
OTHERS,Who is Terrence Malick ?
1,What instrument is Ray Charles best known for playing ?
OTHERS,"What 's the meaning of the Latin battle cry : Ad arma , ad arma ."
1,What is the mascot for Notre Dame University ?
5,"What Las Vegas hotel burned in November , 1980 , with the loss of 84 lives ?"
4,When did Mount St. Helen last have a significant eruption ?
2,CNN is the abbreviation for what ?
4,When did World War I start ?
4,How many feet are there in a fathom ?
OTHERS,What is a Canada two-penny black ?
5,What European city do Nicois live in ?
OTHERS,How can I find out what year a Beanie Baby was introduced ?
OTHERS,What is the classic definition of tragic hero ?
1,To what does Microsoft 's Windows 3 owe its success ?
OTHERS,Who was President of Afghanistan in 1994 ?
1,"What are other ways of getting stretch marks besides pregnancy , weight loss , and weight lifting ?"
1,What did brontosauruses eat ?
1,What color bottles do good Rhine wines come in ?
OTHERS,Who was the lead actress in the movie ` Sleepless in Seattle ' ?
OTHERS,Who was the 16th President of the United States ?
OTHERS,Who are the two sons of Ozzie and Harriet Nelson ?
OTHERS,What is molybdenum ?
4,When is Boxing Day ?
1,What is the lowest level of the American judiciary ?
4,How many people did Randy Craft kill ?
1,What 's the official animal of Canada ?
4,When did Spielberg direct `` Jaws '' ?
4,What is the size of the largest akita ?
1,What animal has the biggest eyes ?
5,What is California 's capital ?
OTHERS,Who was the author of the book about computer hackers called `` The Cuckoo 's Egg : Tracking a Spy Through the Maze of Computer Espionage '' ?
OTHERS,Who was the founding member of the Pink Floyd band ?
5,What European country is home to the beer-producing city of Budweis ?
OTHERS,How do I find the balance of my social security account ?
5,Where was Christopher Columbus born ?
OTHERS,How do you get to the top of the Eiffel Tower ?
2,What does ` PSI ' stand for ?
5,What sea did the Romans call mare nostrum ?
5,What city did the Flintstones live in ?
1,What is Latin for incompetent ?
1,What chemicals are used in lethal injection ?
OTHERS,What toy company is the world 's No.1 maker of female apparel ?
1,What board game does a `` wood-pusher '' play poorly ?
OTHERS,Which Doonesbury character was likely to turn into a werewolf ?
2,What is the abbreviation for micro ?
1,What are the 7 articles of the constitution ?
OTHERS,Who has won the most Super Bowls ?
2,What does NASDAQ stand for ?
2,What is BPH ?
1,What is the fastest commercial automobile that can be bought in the US ?
5,What stadium do the Miami Dolphins play their home games in ?
OTHERS,Who has the only speaking role in `` Silent Movie '' ?
OTHERS,Why is poop sometimes different colors ?
4,What was Einstein 's IQ ?
4,What day was Pearl Harbor attacked in 1942 ?
5,What state is John F. Kennedy buried in ?
1,What is the best way to remove wallpaper ?
5,What U.S. state has an element named for it ?
OTHERS,How did the tradition of best man start ?
4,How many years ago did the ship Titanic sink ?
5,What is the deepest area of the Arctic Ocean ?
1,What are Halloween 's colors ?
OTHERS,How is silk screening done ?
4,"What is the latitude and longitude of El Paso , Texas ?"
OTHERS,Who made a boat out of gopher wood ?
5,Where can I find a `` Fifth Element '' screensaver ?
OTHERS,Which Bloom County resident wreaks havoc with a computer ?
OTHERS,How do you match a name to a social security number ?
OTHERS,How does a rainbow form ?
4,What is the normal resting heart rate of a healthy adult ?
4,What is the population of Ohio ?
OTHERS,Hazmat stands for what ?
1,What creature scares people in the film `` Jaws '' ?
OTHERS,What part did John Peter Zenger play in the deveopment of the newspaper in America ?
OTHERS,Who followed Caesar ?
1,What are the four elements ?
OTHERS,Who was the first woman golfer to earn a million ?
1,What 's the tallest piece on a chessboard ?
5,What is Answers.com 's address ?
5,Where can I buy movies on videotape online ?
OTHERS,Who does the advertizing for Frito-Lay ?
OTHERS,Who is the leading competitor of Trans Union Company ?
1,What product did Robert Conrad dare people to knock off his shoulder ?
4,What 's the American dollar equivalent for 8 pounds in the U.K. ?
1,What are the different approaches of systems analysis ?
OTHERS,How do doctors diagnose bone cancer ?
OTHERS,Who is the man behind the pig-the man who pulls the strings and speaks for Miss Piggy ?
1,What are the developmental stages of a swimmer ?
OTHERS,What actor first portrayed James Bond ?
5,What ocean is the largest in the world ?
OTHERS,"Who was the first American poet to win the Nobel Prize for literature , in 1948 ?"
4,What year did Jack Nicklaus join the Professional Golfers Association tour ?
4,How many sonnets did Shakespeare write ?
OTHERS,What causes the redness in your cheeks when you blush ?
OTHERS,Who won the Nobel Peace Prize in 1991 ?
OTHERS,Who are the Challengers of the Unknown ?
OTHERS,Define the Pheonix Club ?
5,Which city did Christian Crusaders fight to recapture from the Muslims ?
OTHERS,What does it mean `` Rupee Depreciates '' ?
1,What gaming devices were dubbed `` Mississippi marbles '' and `` Memphis dominoes '' ?
OTHERS,Who was the first coach of the Cleveland Browns ?
OTHERS,How successful is arometherapy ?
1,What Jewish holiday saw the start of the 1973 Mideast War ?
OTHERS,How does a copier work ?
4,What is the speed of the Mississippi River ?
OTHERS,Who said of Super Bowl III in 1969 : `` We 'll win- I guarantee it '' ?
OTHERS,Who declared : `` I am down on whores and I shan 't stop ripping them '' ?
1,What TV game show once saw a contestant admit to picking his toes in the shower ?
OTHERS,What Soviet leader owned a Rolls-Royce ?
5,Where can I find a case on Individuals with Disabilities Education Act of 1991 ?
1,What war did Florence Nightingale tend the troops in ?
OTHERS,"Who wrote the song , `` Stardust '' ?"
4,How many Beatles ' records went #1 ?
OTHERS,Who is the only prime minister of Canada to serve 22 years but not necessarily consecutively ?
5,What mountains lie between the Arkansas and Missouri rivers ?
OTHERS,Who received the Will Rogers Award in 1989 ?
OTHERS,What is the function of RAM ?
5,What 's the closest G2 Spectrum Yellow Dwarf to Earth ?
4,How many equal angles are there in an isosceles triangle ?
1,What is the fear of cockroaches called ?
1,What CBS soap opera was interrupted by the bulletin of John F. Kennedy 's assassination ?
OTHERS,What is the use of a 24-hour clock instead of a 12-hour clock ?
OTHERS,What was the name of the lawyer who represented Randy Craft ?
OTHERS,What United States President had dreamed that he was assassinated ?
1,What film did Lee Marvin win the 1965 best actor Oscar for ?
1,What product does `` Mrs. Olsen '' promote ?
4,What time of day did Emperor Hirohito die ?
OTHERS,What is dry ice ?
1,What 's the most powerful card in Euchre ?
OTHERS,What does `` intractable plantar keratoma '' mean ?
4,How many years did it take James Joyce to write Ulysses ?
1,What crop failure caused the Irish Famine ?
4,How many types of dogs ' tails are there - three
1,What is the longest-running television series ?
1,What predators exist on Antarctica ?
OTHERS,What is the difference between a generator and an alternator ?
OTHERS,How is energy created ?
1,What beer advertised that it had `` three rings '' ?
4,What is the quantity of American soldiers still unaccounted for from the Vietnam war ?
1,What golfing accessory was patented by George Grant on December 12
OTHERS,How is it correct to say ` qigong ' ?
5,What was the highest mountain on earth before Mount Everest was discovered ?
5,"Where was the Ligurian Republic , 1797-185 , ?"
5,What country 's people are the top television watchers ?
4,When was the women 's suffrage amendment ratified ?
1,What movie tour of the Roman empire features the admonition : `` Row well and live '' ?
OTHERS,"What President lived at 219 North Delaware Street , Independence , Missouri ?"
OTHERS,Give a reason for American Indians oftentimes dropping out of school .
5,Where must a soccer goalie stand to be permitted to handle the ball ?
5,In what U.S. state was the first woman governor elected ?
OTHERS,What are some interesting facts and information about dogsledding ?
1,What kind of animal is Babar ?
OTHERS,What is Jane Goodall known for ?
1,What killed Bob Marley ?
4,How much money are Dumbo 's ears insured for ?
OTHERS,Who danced into stardom with Fred Astaire in 1941 's You 'll Never Get Rich ?
OTHERS,Who is Stein Eriksen ?
OTHERS,What does the name Billie mean ?
OTHERS,Who is the fastest swimmer in the world ?
5,What is the highest peak in Africa ?
5,Where is Procter & Gamble headquartered in the U.S. ?
5,What desert has been called The Garden of Allah ?
1,What do bicornate animals have two of ?
1,What is a fear of weakness ?
4,How many miles is it to Ohio from North Carolina ?
4,How much snow equals an inch of rain ?
2,What does G.M.T. stand for ?
OTHERS,What does Inuit and Eskimo mean ?
1,What song served as the closing theme of The Johnny Cash Show ?
1,What field sport did dentist William Beers promote and write a standard book of rules for ?
OTHERS,How do I tie dye clothes ?
4,When does the average teenager first have intercourse ?
OTHERS,Why doesn 't www.answers.com have any answers to my questions ?
OTHERS,What actor 's autobiography is titled All My Yesterdays ?
OTHERS,What Russian master spy lived in the U.S. under the name Emil Goldfus ?
5,Where 's the 19th hole on a golf course ?
OTHERS,Who played the original Charlie 's Angels ?
5,Where can I find a person 's address from a telephone number ?
1,"What English word comes from the Old French covrefeu , meaning cover fire ?"
1,What musical instrument did Prewitt play in James Jones 's From Here to Eternity ?
5,Where did Sarge Steel get his metal hand ?
OTHERS,What makes popcorn pop ?
OTHERS,Who wrote The Night of the Iguana ?
1,Where does your hair grow the fastest ?
5,What country did King Gustav V reign over from 197 to 195 ?
OTHERS,Who painted Mother and Child ?
4,What is the speed of the Mississippi River ?
5,What is the brightest star visible from Earth ?
1,What film marked Robert Redford 's directorial debut ?
1,What film or films has Jude Law appeared in ?
5,Where do hyenas live ?
OTHERS,Who has more DNA - a man or a woman ?
OTHERS,What are Maid-Rites ?
1,"What children 's tale contains the line : `` Come , Cinderslut , and hold this skein of wool for me '' ?"
OTHERS,What level of government or governmental agency is responsible for dealing with racism ?
4,How many referees work a soccer game ?
1,What cocktail do you concoct with whisky and sweet vermouth ?
1,How do you say `` fresh '' in Spanish ?
OTHERS,What do bee hives do in cranberry bogs ?
OTHERS,What caused the Lynmouth floods ?
4,When is the Tulip Festival in Michigan ?
OTHERS,"Who came up with the name , El Nino ?"
1,What movie did Madilyn Kahn star in with Gene Wilder ?
1,What type of bridge is the Golden Gate Bridge ?
OTHERS,What dictator has the nickname `` El Maximo '' ?
OTHERS,What stereo manufacturer is `` Slightly ahead of its time '' ?
5,What U.S. city is The Queen of the Pacific ?
OTHERS,What TV sitcom character had the maiden name Ethel Potter ?
1,What was the first Lifesaver flavor ?
5,Where can I find out the top 1 singles ?
4,How many degrees cooler is the inside of a cucumber than the air outside ?
OTHERS,What Spanish artist painted Crucifixion ?
1,What is the Jewish bible called ?
OTHERS,Why is the grass green ?
OTHERS,What is a firewall ?
OTHERS,What spy novelist served as Moscow correspondent for Reuter and The Times of London ?
OTHERS,Which oil company almost picked a word that meant `` stalled car '' in Japanese as its new international name ?
4,How long does it take for Spider-Man 's web to evaporate ?
5,What was known as the Spice Island ?
OTHERS,Who was the first host of Person to Person ?
OTHERS,Name the Ranger who was always after Yogi Bear .
1,What does the Statue of Liberty wear on her feet ?
OTHERS,Who is the superstar in rent-a-cars ?
5,McCarren Airport is located in what city ?
1,"What household facility contains a float ball , ballcock , and overflow tube ?"
1,What was the name of Betty Boop 's dog ?
4,What fraction of a beaver 's life is spent swimming ?
1,What was the Bridge of San Luis Rey made of ?
OTHERS,What do economists do ?
5,What country has the largest sheep population ?
OTHERS,"What do I need to do to take my dog with me to live in Dominica , West Indies for a year ?"
5,What country is the world 's largest importer of cognac ?
4,How many years is Johnnie Walker Black Label aged ?
2,What does SIDS stand for ?
1,What is Grenada 's main commodity export ?
4,"How much would a black-and-white 1-cent stamp be worth , Thomas Jefferson on it , ?"
OTHERS,What makes a clitoris sensitive ?
5,"What country has the most time zones , with 11 ?"
1,What `` magic '' does Mandrake employ ?
OTHERS,Who is the president of Stanford University ?
OTHERS,Whose first presidential order was : `` Let 's get this goddamn thing airborne '' ?
1,"What was introduced commercially by Bayer A.G. of Leverkusen , in 1899 ?"
5,What city is Logan Airport in ?
OTHERS,What is a nanometer ?
4,How many innings are there in a regulation softball game ?
5,What is the largest city on the Great Lakes ?
4,What is the telephone number for the University of Kentucky ?
OTHERS,Who invented baseball ?
1,What product on the market is good for hiding facial scars ?
4,How long is the Coney Island boardwalk ?
5,What city gained renown for its pea-soup fogs ?
OTHERS,What does `` Janelle '' mean ?
OTHERS,How do I get another city 's newspaper ?
1,Name a movie about the Sioux Indians starring Kevin Costner .
