label-coarse,text
OTHERS,What businesses or agencies would do an employment verification ?
OTHERS,"What famous coach said `` if you can 't beat 'em in the alley , you can 't beat 'em on the ice '' ?"
4,How many claws has a lobster called a pistol lost ?
OTHERS,Who was Darth Vader 's son ?
1,What are the four most widely-used languages in North America ?
1,What war was fought by the Spanish as far as the Philippines ?
OTHERS,How do you make a million bucks ?
OTHERS,Who invented the process to make condensed milk ?
5,What is the largest city in Connecticut ?
4,What is the population of the United States ?
OTHERS,What actor and actress have made the most movies ?
OTHERS,What is the definition of spamming ?
OTHERS,Who found Hawaii ?
2,What does IQ stand for ?
5,Where can I find free piano scores for popular music ?
4,When did the American Civil War end ?
5,What country is the largest diamond producer ?
4,How long does it take the moon to revolve around the Earth ?
1,What beer is ` rockin ' America ? ''
1,What is a fear of women ?
OTHERS,Who protects DC Comics ' realm of dreams ?
1,What are dinosaur droppings called ?
OTHERS,What was the infamous feat of Germany 's U-2 submarine ?
1,What Homerian epic chronicles events toward the end of the Trojan Wars ?
4,When did the vesuvius last erupt ?
1,What is widely used to detect prenatal birth defects ?
4,When did the supercontinent Pangaea break up ?
1,What kind of mammal is a colt ?
OTHERS,Who created Harry Lime ?
OTHERS,Why do many Native American students not complete college ?
OTHERS,Who was President Cleveland 's wife ?
1,What class of animals makes up more than two-thirds of known species ?
1,What was the name of Sergeant Preston of the Yukon 's lead dog ?
1,What film featured a snarly character named Kid Shelleen ?
OTHERS,What company named one of its pens `` The Banana '' ?
5,What 's the capital of Monaco ?
4,What do Englishmen weigh themselves in ?
4,How big is the Electoral College ?
1,"What is it that walks on four legs , then on two legs , then on three ?"
1,What is the name of the 1919 occurrence in which British troops killed over 3 unarmed Indian protestors ?
OTHERS,Who invented the Moog Synthesizer ?
OTHERS,Who makes the `` Die Hard '' car battery ?
4,How long does it take to travel from Tokyo to Niigata ?
5,What state is the Filenes store located in ?
OTHERS,How does a bill become law ?
4,What is the starting salary of a radiographer ?
OTHERS,What is a disaccharide ?
OTHERS,Colin Powell is most famous for what ?
1,What star-faring race brought about the Inhumans on Marvel 's Earth ?
OTHERS,What does appropriates money mean ?
OTHERS,What is the name of Dolly Parton 's rarely seen husband ?
OTHERS,Whose old London come-on was : `` Buy my sweet lavender '' ?
OTHERS,How did former WWF wrestler Rick Rude die ?
OTHERS,Who wrote the lyrics to Porgy and Bess ?
OTHERS,What is a `` False Moon '' ?
1,What 1976 Deep Throat clone provides the leading lady with a second larynx ?
1,What line of luggage is named after a famous American flier ?
1,What is a word whose letters can be rearranged to form a different word ?
4,What chapter of Gone with the Wind has Rhett Butler leaving Scarlett O 'Hara ?
4,"When did Lucelly Garcia , a former ambassador of Columbia to Honduras , die ?"
1,"In Hemingway 's `` Old Man and the Sea , '' what kind of fish does the old man catch ?"
4,How long was the longest sneezing attack ?
OTHERS,How can I get rich quick ?
OTHERS,How is the word ` qigong ' pronounced ?
1,What program do I need to run a .tbk file ?
OTHERS,What two New York Yankee pitchers swapped wives and families ?
1,What are the 10 plagues of Egypt ?
OTHERS,"What is the history of Hot Wheels cars , and how are they produced ?"
1,What is the rounded part on the top of a matchbook called ?
4,When did Nixon visit China ?
4,What 's the third month of the Gregorian calendar ?
5,What country owns Corsica ?
4,How many queen bees reign in a hive ?
1,"What sport features slotbacks , tailbacks , and touchbacks ?"
1,What meat complemented sweet potatoes and peas in the first TV dinner ?
2,What is RAM in the computer ?
OTHERS,What is a `` repeating voter '' ?
OTHERS,What are dingoes ?
5,Where can I find a world atlas map online at no charge ?
1,What Leoncavallo opera features a prologue by a clown ?
4,What chapter of the Bible has the most verses ?
5,What ocean did the Titanic sink in ?
OTHERS,How did P.T. Barnum bill the diminutive Charles S. Stratton ?
4,In what year was the Wall built ?
OTHERS,Name one of King Henry VIII 's wives .
5,What southwestern state is dubbed The Silver State ?
OTHERS,What are pomegranates ?
OTHERS,What does Robin Williams do ?
5,What country did the Allies invade in World War II 's Operation Avalanche ?
5,What famed river was Hernando de Soto the first European to see ?
1,What chess outcome results when a player has no legal move ?
OTHERS,How do they find an epicenter ?
5,Where do quality drinks begin ?
1,"In order from the top , the four stripes on a can of Pepsi are what colors ?"
1,What kind of substance is dextropropoxyphen napsylate ?
OTHERS,Who is the French literary charcter who is chiefly famous for his enormous nose ?
5,"What country surrounds San Marino , the world 's smallest Republic ?"
OTHERS,Who killed Martin Luther King ?
OTHERS,What did Cool Hand Luke go to jail for ?
OTHERS,What was the V-8 Juice slogan : `` the tastebud '' ?
1,What was Mae West 's last film ?
1,What letter does Gorbachev 's middle name start with ?
OTHERS,Who invented Astroturf ?
OTHERS,What makes you fat ?
4,What season does a hiemal activity normally take place in ?
5,What direction do the best surfing beaches face ?
4,What is the world record for the longest hair ?
1,What English word contains the most letters ?
OTHERS,How do I know if I 'm jealous of someone ?
OTHERS,What Democratic prankster waved the train out of the station while Richard Nixon spoke from the caboose ?
OTHERS,How does James Bond like his martinis ?
5,What California bay 's largest island is Angel Island ?
1,What was the name of the flight that Fawaz Younis hijacked ?
OTHERS,What former African leader held his country 's boxing title for nine years ?
5,"What California bridge was Don Brown the first to cross , on May 27 , 1937 ?"
OTHERS,"What camera company said , `` If you haven 't got the time , we 've got the camera ? ''"
OTHERS,What happened to Pepsi Clear ?
OTHERS,What is a Mexican hairless ?
OTHERS,What 2th-century American poet wrote a four-volume biography of Abraham Lincoln ?
5,Where is the oldest living thing on earth ?
1,What piece of jewelry is pictured on Monopoly 's Luxury Tax space ?
OTHERS,"Who stopped making diary entries on May 31 , 1669 , because he thought he was going blind ?"
OTHERS,What journalist can be found in and around Walden Puddle ?
OTHERS,How did Socrates die ?
4,How many sides does an obelisk have ?
1,What was Edward Albee 's first full-length play ?
1,What was lost and regained by poet John Milton ?
OTHERS,What woman pitcher has struck out Ted Williams and Hank Aaron ?
OTHERS,How can scientists predict weather by observing clouds ?
1,What songs were popular in 1948 ?
4,In what year was the cannon invented ?
4,How many languages does the Pope speak ?
5,What bay divides Maryland 's Eastern and Western Shores ?
OTHERS,"What Frenchman claimed the following ? If God did not exist , it would be necessary to invent him . ''"
OTHERS,What is the origin of the expression `` four-letter word '' ?
OTHERS,Who was the first woman in space ?
1,What is the only animal that can turn its stomach inside out ?
OTHERS,What professional sports league originated the college draft ?
OTHERS,What is the difference between a board of directors and an advisory board ?
OTHERS,Who discovered imaginary numbers ?
OTHERS,Who does the voices of the Simpsons ?
4,How many feet high is the hurdle in front of a runner 's steeplechase water jump ?
1,What religion has the most members ?
4,How many calories are there in a glass of water ?
OTHERS,"Who is the richest person in the world , without owning a business ?"
2,What is SVHS ?
4,What is the chemical reactivity of neon ?
5,Where can I find info on Alexander Mackenzie ?
5,What Georgia town did Scarlett O 'Hara condemn as being full of pushy people ?
4,How many countries watch MTV Europe ?
2,What is SAP ?
1,What layer of the atmosphere contains most of the ozone layer ?
4,What is the airport code for Los Angeles International ?
OTHERS,"In the song `` Yankee Doodle , '' why did Yankee Doodle stick a feather in his cap and call it macaroni ?"
2,"What do the letters CE stand for on so many products , particularly electrical , purchased now ?"
5,Where did the real St. Nicholas live ?
OTHERS,"Who manufactures the software , `` PhotoShop '' ?"
4,How many eyes does a bat have ?
1,How do you say 2 in Latin ?
1,What was Dwight Eisenhower 's favorite card game ?
1,"What is the high pitched sound that you hear in your ear every now and then , but then it goes away , after a while ?"
OTHERS,What is the origin of the word nevermind ?
OTHERS,Who was the second man to walk on the moon ?
OTHERS,What is power steering ?
5,Where did Dikembe Mutombo go to college ?
OTHERS,What author was appointed U.S. ambassador to Spain in 1842 ?
5,What body of water does the Yukon River empty into ?
OTHERS,Who is Westview High 's band director in Funky Winkerbean ?
OTHERS,How does a chick breathe inside an egg ?
5,What is Mark McGwire 's e-mail address ?
4,How many maids were milking ?
5,The Kentucky Horse Park is located near what city ?
1,What is the celtic symbol for `` life '' ?
1,What kind of fruit is a Yellow Transparent ?
1,What song put James Taylor in the limelight ?
1,"What drink is formed of tequila , orange juice and galliano ?"
1,Name four comic strips about pilots .
4,What geological time do we live in ?
5,Where is Microsoft 's corporate headquarters located ?
OTHERS,How did the Hohenzollerns build their power around 17 ?
4,When was China 's first nuclear test ?
1,What is the name given to a group of geese ?
OTHERS,"Why was Washington , DC originally called District of Columbia ?"
OTHERS,How do I find a snowboarding website ?
OTHERS,What singer 's hit song inspired the Dolly Parton Stallone movie Rhinestone ?
OTHERS,Why do movie and TV stars get paid so much ?
OTHERS,What is a turnkey contract ?
OTHERS,What are people doing to help prevent the extinction of birds ?
OTHERS,Why is the mile 528 feet ?
5,What Asian gulf were the destroyers Maddox and C Turner Joy shot up in ?
OTHERS,How is carbon dioxide removed from natural gas ?
OTHERS,Who is Edmund Kemper ?
OTHERS,"What was Mao , the Chinese leader 's , full name ?"
OTHERS,"Who is the director of the international group called the Human Genome Organization , HUGO , that is trying to coordinate gene-mapping research worldwide ?"
OTHERS,What radio station did Paul Harvey work for ?
OTHERS,What character narrates Treasure Island ?
2,What is the correct way to abbreviate cc. at the bottom of a business letter ?
OTHERS,Who starred with Charlie Chaplin in Modern Times and The Great Dictator ?
4,What seven digits follow the area code in the number for long distance information ?
OTHERS,What Catch-22 character is elected mayor of half a dozen Italian cities ?
OTHERS,"Whom does Uncle Duke 's girl friend , Honey , room with ?"
OTHERS,"When called upon to surrender , what American general replied , `` Sir , I have not yet begun to fight . '' ?"
4,When was the bar-code invented ?
1,What has to be produced in a writ of habeas corpus ?
OTHERS,What team did Babe Ruth play his first major league game for ?
1,What class is categorized as the bourgeoisie ?
OTHERS,What relative of Leo Tolstoy translated War and Peace eight times ?
OTHERS,How does the Nintendo `` Zapper '' work ?
4,How many cards is each player dealt in Contract Bridge ?
OTHERS,Who was the second person ever to wear Iron Man 's armor ?
OTHERS,Who is the director and editor of the movie Big starring Tom Hanks ?
OTHERS,What is the `` fourth dimension '' ?
5,What is the Homelite Inc. home page ?
4,How old was Stevie Wonder when he signed with Motown Records ?
OTHERS,What is `` alternative '' anymore ?
OTHERS,Why do they call a hamburger a hamburger when there is no ham ?
OTHERS,Who won two gold medals in skiing in the Olympic Games in Calgary ?
4,What year was the Avery Dennison company founded ?
4,Where does the U.S. rank among world countries in area ?
OTHERS,What are the four railways in Monopoly ?
5,What are the names of all the seas in the world and what ocean do they drain into ?
2,What does BMW stand for ?
5,Name the highest mountain .
OTHERS,What is a biologist ?
OTHERS,What revelation did Alexander Butterfield make to the Senate Watergate committee ?
5,What island is home to statues called Mauis ?
1,What is a fear of black people ?
1,What 's the most extensively grown and eaten food ?
1,What was the worst hurricane ?
OTHERS,How can I get started in writing for television ?
5,Where was Pythagoras born ?
1,What 1927 silent film received an international revival in 1981 ?
4,What is the price for AAA 's liability auto insurance ?
2,What is LMDS ?
OTHERS,Who are the top ten richest people in the world ?
OTHERS,Who is the leader of Brunei ?
5,What is the capital of Italy ?
OTHERS,How do you get a pointsettia to turn red ?
1,What is kept in Fort Knox that is so valuable ?
5,What is the greatest hiking Web site ?
4,"What is the population of Arcadia , Florida ?"
1,What Stephen King novel is set in a graveyard for pets ?
OTHERS,Who were the head writers for the Smothers Brothers Comedy Hour ?
OTHERS,Who portrayed Prewett in From Here to Eternity ?
1,What was the sequel to The Pink Panther ?
4,How many people live in cities ?
4,How high must a mountain be to be called a mountain ?
OTHERS,What Scottish poet penned To a Mouse and To a Louse ?
OTHERS,What is the name of the inventor of silly putty ?
5,What ocean surrounds the Madeira Islands ?
OTHERS,What famous communist leader died in Mexico City ?
1,What was John Steinbeck 's travelling companion Charley ?
5,What are the capital cities of the two large countries that occupy the Iberian peninsula in Europe ?
4,How many mines can still be found in the Falklands after the war ended ?
OTHERS,How can I get in touch with Michael Moore of `` Roger & Me '' ?
OTHERS,How is ` qigong ' properly pronounced ?
4,How many gallons of water go over Niagra Falls every second ?
1,What turns blue litmus paper red ?
4,How many copies of an album must be sold for it to be a gold album ?
1,What is `` the soft drink for adults '' ?
1,What is the only vegetable that starts with `` z '' ?
OTHERS,Who awarded The Flying Fickle Finger of Fate ?
5,"In Sinclair Lewis ' `` Main Street , '' what was the name of the typical American town ?"
1,What hide-and-seek game is played around a tin can ?
5,What is the largest city in Texas ?
OTHERS,"What future deer hunter portrayed Annie Hall 's neurotic brother , Duane ?"
1,What drink is the best thirst-quencher ?
5,Where can I get a map of Prussia on the Internet ?
OTHERS,What is a `` node '' in computer terms ?
5,Where is McCarren Airport ?
OTHERS,What are the top boy names in the U.S. ?
4,How many tiles did the Space Shuttle Columbia lose on its second flight ?
4,How many teaspoons make up a tablespoon ?
OTHERS,Who was the lyricist and who was the composer between Gilbert and Sullivan ?
OTHERS,Who was the lawyer for Randy Craft ?
OTHERS,What is the origin of the word Marijuana ?
OTHERS,Who was the 3rd president of the United States ?
1,What organ contains the islands of Langerhans ?
OTHERS,Name Dick Tracy 's two children .
1,What is a fear of points ?
4,What fraction of a beaver 's life is spent swimming ?
1,What is the most radioactive food ?
OTHERS,What was the previous name for the Commonwealth ?
4,How much will gas be taxed in California by the year 2000 ?
OTHERS,Who gave King Arthur the round table ?
5,What state in the United States covers the largest area ?
OTHERS,How do you make a computer chip ?
OTHERS,Who became president of the U.S. in 1789 ?
OTHERS,Who wrote `` The Scarlet Letter '' ?
OTHERS,Who did Sara Jane Moore try to assassinate ?
4,How many dots make up the symbol for `` because '' ?
OTHERS,What title did Shevardnadze have during the Soviet era ?
1,What did the pyramid-builders of Egypt mainly eat ?
1,What 's the international radio code word for the letter F ?
1,What are the 28 tenses in the English language ?
OTHERS,Which king signed the Magna Carta ?
1,What software offers inventors use of CAD-like design ?
OTHERS,What is agent orange ?
OTHERS,Name the child left on a doorstep at the beginning of Gasoline Alley .
4,How many zip codes are there in the U.S. ?
1,"In Beetle Bailey , can you name Sarge 's dog ?"
OTHERS,Why shouldn 't you remove a bee stinger with tweezers ?
OTHERS,Which college did Dikembe Mutombo play basketball for ?
OTHERS,Why did Europeans first come to Australia and Oceania ?
OTHERS,What did the Confederate Constitution say about slavery ?
4,How long does it take the Milky Way Galaxy to make one revolution ?
4,How many people own pets ?
5,What web sites are linked to the Report on Genesis Eldercare ?
1,What is a fear of lice ?
4,How many colors are there in a rainbow ?
OTHERS,What was Darth Vader 's son named ?
OTHERS,What problems contributed to the high failure rate of Plains farmers in the 1800s ?
OTHERS,What British female pop singing star of the 1960s and early 1970s was a child actress in the 1940s and '50s ?
5,Where is McCarren Airport located ?
OTHERS,How effective are condoms in protecting against AIDS ?
5,"What part of Britain comprises the Highlands , Central Lowlands , and Southern Uplands ?"
4,How many Marx Brothers were there ?
4,How tall is the Matterhorn ?
5,What country is proud to claim Volcano National Park ?
OTHERS,Who portrayed Field Marshal Erwin Rommel in The Desert Fox ?
5,What direction do most baseball pitchers pitch toward ?
4,How many Beanie Baby sites are there ?
OTHERS,How can I call a friend in another country when I do not know the telephone number ?
1,What is 55 times sweeter than cane sugar ?
5,Where are diamonds mined ?
OTHERS,How do they get Teflon to stick to the pan ?
OTHERS,Who makes the `` cross-your-heart bra '' ?
OTHERS,Who is Archie Bunker 's son-in-law ?
OTHERS,What company produces Spumante ?
OTHERS,What is the origin of music ?
2,What does `` B.Y.O.B. '' mean ?
OTHERS,What major airline has the best safety record in the world ?
4,How many innings constitute an official baseball game ?
5,What city has a newspaper called The Plain Dealer ?
5,What U.S. state boasts Leif Ericson Park ?
4,How many flavors does Baskin & Robbins offer ?
OTHERS,Who was chief engineer of the Starship Enterprise ?
OTHERS,How does crosstalk relate to InSb thickness in infrared detectors ?
OTHERS,What mayor made so many TV appearances he was asked to join AFTRA in 1984 ?
1,Which type of submarine was bought recently by South Korea ?
4,How much in miles is a ten K run ?
4,When was Beethoven born ?
OTHERS,Who is the most sexy celebrity ?
OTHERS,What detective lives on Punchbowl Hill and has 11 children ?
5,Where did the ukulele originate ?
OTHERS,What does seccession mean ?
OTHERS,Who portrayed the title character in the film The Day of the Jackal ?
5,What is the name of the gulf between Sweden and Finland ?
OTHERS,Who was the first X-Man to die in battle ?
OTHERS,What will the weather be today ?
1,Which sex is denied voting rights in Kuwait ?
5,What two countries is Andorra nestled between ?
4,How long ago was the Roe vs. Wade decision by the Supreme Court ?
OTHERS,What terrorist group was headed by Donald DeFreeze ?
5,What are the four largest mountain ranges in the continental United States ?
4,What is the size of the student body at the University of Massachusetts in Amherst ?
OTHERS,How can I determine the radius of an ellipse ?
OTHERS,Who starred in the movie The War of the Worlds ?
4,How many different kinds of ice cream are there ?
OTHERS,"What actor , who had greatest fame on TV , became the father of triplets ?"
5,What is the Homelite Inc. home page ?
OTHERS,What is the Golden Rule ?
1,What is a movie that Kevin Costner made about Sioux Indians ?
1,What were millions of kids wearing on their heads in 1955 ?
OTHERS,How does color affect a person psychologically ?
4,What is Columbia Tristar 's phone number ?
1,What type of animal is the easiest kept pet there is ?
OTHERS,What is sound ?
1,"What was the name of the horse that fell on Queen Elizabeth , Prince Albert 's wife ?"
OTHERS,What are the current immigration laws in US ?
1,What were the five opening words on Ben Casey ?
OTHERS,Why does it say on children 's cough syrup not to drive while using this medication ?
1,What hair color can I use to just cover a little gray ?
5,Where was Tesla born ?
OTHERS,What does Larry King do for a living ?
OTHERS,Who shot Lee Harvey Oswald ?
1,What blood sport features a movement called a veronica ?
1,What was spawned the term `` MiG Alley '' ?
OTHERS,What is the origin of infinity ?
1,What alloy do copper and tin form ?
1,What plants are found in an estuary ?
OTHERS,What are the side effects of mevacor ?
5,What are the top 5 tallest buildings in the world ?
OTHERS,Colin Powell is best known for what achievement ?
OTHERS,Who portrayed Renaud in Casablanca ?
5,What country has problems with hooligans ?
5,What planet did Percival Lovell discover ?
4,How often are brain cells replaced ?
4,How much did Mercury spend on advertising in 1993 ?
1,What kind of rocket launched the Surveyor spacecraft ?
5,What country contains the westernmost point in South America ?
1,What did Abolitionists try to end ?
OTHERS,Why should cigarette smoking be banned ?
4,What year did Charles Dicken die ?
1,What D.H. Lawrence novel was originally titled Tenderness ?
OTHERS,What rock group raised a ruckus at the White House by singing American Woman ?
1,What is a fear of night or darkness ?
OTHERS,What is the origin of the rock band Led Zeppelin 's name ?
OTHERS,How was Lawrence
OTHERS,How do I know if I am pregnant ?
4,When did the last Americans leave Vietnam ?
OTHERS,What famed clown appeared on an early Howdy Doody Show and insisted that Clarabell be made up as a real clown ?
OTHERS,"What group was formed in 1969 after police met resistance from patrons at the Stonewall , a Greenwich Village gay bar ?"
OTHERS,Who was Confucius ?
1,What snack food has ridges ?
1,What 's the most popular four-player game of all time ?
OTHERS,What 's the meaning of the name Tatiana ?
4,How many people died when the Estonia sank in 1994 ?
5,What Southern California town is named after a character made famous by Edgar Rice Burroughs ?
4,How many colors are there in a rainbow ?
5,What is the habitat of the chickadee ?
1,What drug is often used to treat AIDS patients ?
1,Which of the five senses develops first ?
OTHERS,Where did the name root beer come from ?
5,What city 's the kickoff point for climbs of Mount Everest ?
4,What is the average salary of a paleontologist ?
5,Where is the largest post office building in the world ?
OTHERS,Who is currently the most popular singer in the world ?
1,Who was the first animal into space ?
1,What is the correct way to mount a roll of toilet paper ?
1,What Jules Verne novel features scientists held captive in the submarine Nautilus ?
OTHERS,Why is Rush 's 2112 called 2112 ?
OTHERS,What 's the state motto of California ?
OTHERS,"What company started out making pies , and wound up manufacturing plastic throwing toys ?"
2,What does the acronym CPR mean ?
1,The Jewish alphabet is called what ?
OTHERS,What are the Baltic States ?
4,How many endangered species are there in the world ?
5,Which large U.S. city had the highest murder rate for 1988 ?
OTHERS,"Who was the bandleader mentor of Ella Fitzgerald with whom she cowrote `` A_Tisket , A-Tasket '' ?"
OTHERS,Who invented basketball ?
OTHERS,How has TV affected our society ?
4,When was the last major eruption of Mount St. Helens ?
OTHERS,What U.S. Government agency registers trademarks ?
OTHERS,What is osmosis ?
OTHERS,What hockey player did Ronald Reagan joke he would swap Texas for ?
1,What is the world 's deadliest infectious disease ?
1,Which infectious disease is the world 's deadliest ?
OTHERS,"What President was buried at his ancestral home overlooking the Hudson River at Hyde Park , New York ?"
4,How much did the first Barbie doll sell for in 1959 ?
5,What country was General Douglas McArthur in when he was recalled by President Truman ?
OTHERS,What are the five most popular Usenet groups ?
OTHERS,What are the seven deadly sins ?
4,"What is the latitude and longitude of El Paso , Texas ?"
OTHERS,What does the name Melissa mean ?
4,How many head injuries are there in recreational ice skating each year ?
4,A normal human pregnancy lasts how many months ?
1,What kind of sports team is the Buffalo Sabres ?
1,What are new computer games for Windows 95 or 98 ?
OTHERS,Who domesticated the wild turkey ?
OTHERS,How can I get someone 's phone number if I only have their screen name ?
1,What European race sees the winner of its mountain stage awarded a jersey with large red polka dots ?
5,What country does Ileana Cotrubas come from ?
OTHERS,What 's the motto of the Boy Scouts ?
5,What two European countries are joined by the Gran San Bernardo Pass ?
1,What movie did Steven Spielberg direct in 1975 ?
1,What kind of creatures are the Canary Islands named for ?
OTHERS,What was the name of the US helicopter pilot shot down over North Korea ?
OTHERS,What 's a male `` cuckquean '' ?
OTHERS,"Name the designer of the shoe that spawned millions of plastic imitations , known as ` jellies ' ."
2,What does RCA stand for ?
OTHERS,Who is Olive Oyl 's brother ?
1,"What 12-hour cold medicine uses the formula `` 6 , 6 , 12 '' in its ads ?"
1,What was the first video ever made ?
1,What 's the favorite food of dragonflies ?
OTHERS,What king boycotted Prince Charles 's wedding ?
OTHERS,What does Nicholas Cage do for a living ?
