label-coarse,text
1,What is a fear of being cold ?
4,How long was Mao 's 1930s Long March ?
1,What four-legged creature did a Cornell University study say would make man 's best companion in space ?
4,What does a teaspoon of matter weigh in a black hole ?
5,What province is Edmonton located in ?
OTHERS,How can I find out how much income tax is paid on Social Security income on the 1998 income tax ?
OTHERS,Who did Sonny Liston succeed as world heavyweight boxing champion ?
1,What is California 's state bird ?
4,What is Martin Luther King Jr. 's real birthday ?
OTHERS,Name the various super-teams to which the Angel has belonged .
OTHERS,How does Zatanna perform her magic in DC comics ?
1,What 's the name of Jacques Cousteau 's research ship ?
OTHERS,What President dispatched a cruiser to carry Charles Lindbergh home after his epic flight ?
1,In which Kevin Costner movie did Sioux Indians play a role ?
4,How many James Bond novels are there ?
OTHERS,How do you get dates with the `` Hooters '' girls ?
1,What bird can swim but can 't fly ?
OTHERS,How can I get a comic character I made copyrighted and published ?
4,How large is the Arctic refuge to preserve unique wildlife and wilderness value on Alaska 's north coast ?
OTHERS,What is Plc ?
4,How much electricity does the brain need to work ?
4,How many acres in a mile ?
1,What Dickens novel has David carrying the message `` Barkis is willin '' to Peggy ?
OTHERS,What is a hyperlink ?
OTHERS,Who 's the twin brother of the Greek goddess Artemis ?
OTHERS,Where did marijuana come from ?
4,"What is the per-capita income of Colombia , South America , ?"
1,What novel has Big Brother watching ?
4,How many Grammys did Michael Jackson win in 1983 ?
OTHERS,What does Elysium mean ?
OTHERS,What is Shalom ?
1,What was the favorite sport of Tom Wolfe 's The Pump House Gang ?
1,What organic fuel do bog-dwellers use a `` slane '' to cut ?
4,What is the average age of a member of the team that worked on the Manhatten Project ?
5,What country received all the Nobel Prizes awarded in 1976 ?
OTHERS,How do you get rid on woodpeckers ?
4,How many syllables are there in a line of hendecasyllabic poetry ?
1,"What soft drink first appeared in the Old Corner Drug Store in Waco , Texas , in 1885 ?"
5,What is Britain 's possession on the Chinese mainland ?
OTHERS,Who was America 's first Public Enemy No. 1 ?
4,How many children under 18 are victims of some sort of Physical Abuse each year ?
OTHERS,What is the origin of thank you notes ?
1,What did Jimmy Stewart invent ?
1,What generation am I in ?
OTHERS,Who is Dear Abby ?
OTHERS,"Who lives at 24 Sussex Drive , Ottawa ?"
1,What is Jell-O made from ?
OTHERS,Who was Monet ?
OTHERS,How do you make panoramic sugar eggs for Easter - the ones with the scene inside ?
1,What 's the Southern dish made of pigs ' small intestines ?
5,Where is Guam ?
OTHERS,Who was the famous door-to-door brush salesman ?
OTHERS,What is the executor in a will ?
4,How many people in America snore ?
OTHERS,Who is always trying to get the rent from Andy Capp ?
1,What soft drink is most heavily caffeinated ?
OTHERS,Who did Jackie Kennedy commission to write The Death of a President ?
1,Which drug is commonly used to treat AIDS ?
4,How many stars are there on the Soviet Union 's flag ?
OTHERS,What is the difference between microprocessors & microcontrollers ?
OTHERS,Who sought to create The Great Society ?
5,What are tourist attractions in Reims ?
4,What are the lengths of pearl necklaces ?
OTHERS,Who said : `` Soldiers win the battles and generals get the credit '' ?
OTHERS,What is the proof that houseplants metabolize carcinogens ?
OTHERS,What prompted the co-pilot of the Enola Gay to enter only `` My God '' in his log ?
4,How long does it take the typical hen to lay 19 dozen eggs ?
5,What Colorado city owns its own glacier ?
1,What was the name of the Protestant revolt against the supremacy of the Pope ?
OTHERS,What is an arab strap ?
4,"How much does it cost , average or whatever is available , to produce and send junk mail catalogues in the US ? , DT CD NN NN ,"
OTHERS,"Who provides telephone service in Orange County , California ?"
5,Where did guinea pigs originate ?
5,What two countries ' coastlines border the Bay of Biscay ?
OTHERS,Why did Egyptians shave their eyebrows ?
OTHERS,What organization did Mr. Waverly assign agents for ?
4,When was the slinky invented ?
OTHERS,What was Eduard Shevardnadze 's job in the Soviet Union ?
OTHERS,What causes rust ?
OTHERS,Which is the only Dick Tracy villain to appear three times ?
1,What was the monster in Spielberg 's film `` Jaws '' ?
1,What color is an Arctic fox in winter ?
OTHERS,"What do the names Neil , Mary , and Anthony mean ?"
5,"What European capital celebrated its 2 , 000th anniversary in 1951 ?"
OTHERS,Why do people in the upper peninsula of Michagin say `` eh ? '' ?
1,What flower did Vincent Van Gogh paint ?
5,What country was the setting of You Only Live Twice ?
4,What was Thatcher 's approval rating after 10 years in power ?
1,Winnie the Pooh is what kind of animal ?
OTHERS,"What was the first Funk 'N Lata , Brazilian group , success ?"
OTHERS,What is a handheld PC ?
OTHERS,What is Larry King 's job ?
4,How many calories are in a tomato ?
5,In what state was the first co-educational college established
1,What war saw a naval battle between the luxury liners Cap Trafalgar and the Carmania ?
1,What is the treatment for depression ?
1,What is a fear of slime ?
5,What country in Latin America is the largest one ?
5,On which Hawaiian island is Pearl Harbor ?
OTHERS,"What feathered cartoon characters do Yugoslavians know as Vlaja , Gaja , and Raja ?"
1,What Marx Brothers movie centers on a stolen painting ?
OTHERS,What was unusual about Alexandra 's appearance in Josie and the Pussycats ?
OTHERS,What is the origin of the word `` mind '' ?
4,When was Dick Clark born ?
1,What game is fatal to anybody over 21 ?
4,What is the death toll of people dying from tuberculosis ?
OTHERS,What happened to Moon Maiden ?
5,What city is wiener schnitzel named for ?
OTHERS,What are the Urals ?
OTHERS,How can you stop the itch from poison ivy ?
5,What desert has the highest sand dunes ?
5,What two countries contain Sierra Nevada mountains ?
OTHERS,How do you tell your parents you are dating an older man ?
4,How long was the TV mission of Star Trek 's Enterprise to be ?
4,What phone number can I call to have a tree planted ?
4,When did the `` Star-Spangled Banner '' become the national anthem ?
OTHERS,Who was Lacan ?
1,What are the four natural aids used in riding a horse ?
5,What continent 's name appears on the upper left corner of a Budweiser label ?
OTHERS,Who was the Secretary of War in the Civil War during the Battle of Gettysburg ?
OTHERS,Who did Bobby Fischer beat to win the world chess championship ?
5,Where can I get information and statistics on countries and nations ?
1,Name a Gaelic language .
4,"What day is August 13 , 1971 ?"
5,Where can I find a list of all the companies in America that offer a direct stock purchase plan ?
OTHERS,How do you send a movie transcript to Hollywood so that it can be produced into a film ?
1,"What literary classic centers on the search for a treasure in gold worth 7 , 0 pounds ?"
OTHERS,What is the origin of blue for boys and pink for girls ?
1,What is the name of the Michelangelo painting that shows two hands with fingers touching ?
4,How big is a quart ?
OTHERS,What is the Hub of London ?
1,Jude Law acted in which film ?
OTHERS,What causes panic attacks ?
OTHERS,What was the filling in the first golf balls ?
1,What drug did Sigmund Freud become fascinated with while experimenting with the treatment of neurasthenia ?
5,What country was A Terrible Beauty to Leon Uris ?
OTHERS,What is typhoid fever ?
5,Where can I buy a hat like the kind Jay Kay from Jamiroquai wears ?
OTHERS,What are the Twin Cities ?
1,What is Beethoven 's 9th symphony called ?
OTHERS,Name the lawyer for Randy Craft .
1,Which breakfast cereal brought you `` the best each morning '' ?
5,What is the Homelite Inc. home page ?
1,What cancer is commonly associated with AIDS ?
4,How long does it take light to reach the Earth from the Sun ?
OTHERS,Who lives at 39 Stone Canyon Way ?
4,How many questions are on this thing ?
OTHERS,Who played Humpty Dumpty in the 1933 film Alice in Wonderland ?
OTHERS,"Who is Karenna Gore , Al Gore 's oldest daughter , married to ?"
OTHERS,Who played the title role in I Was a Teenage Werewolf ?
OTHERS,Why are there olives in martinis ?
4,In what year did Hitler gain power of Germany ?
OTHERS,What record company produced the 1978 movie The Wiz ?
5,Where can I find information about touring the Philippines ?
1,What did The Gas House Gang play ?
4,How many square feet is Bill Gates ' home ?
OTHERS,What is the highest Roman numeral ?
1,What 's the most popular form of bridge ?
OTHERS,Who was the inventor of the stove ?
OTHERS,What comedian has a legendary reputation for stealing jokes ?
5,Where can I find information on the cyclone that hit New Jersey on 8/28/1941 ?
4,Boxing Day is celebrated on what date ?
1,What are the first ten amendements passed ?
1,What is another term for the painful wrist syndrome ?
OTHERS,How is the new Ford Econoline van F25 V1 engine ?
OTHERS,Who was the king who was forced to agree to the Magna Carta ?
OTHERS,Who was made the first honorary citizen of the U.S. ?
1,What game is Garry Kasparov really good at ?
5,Where was Richard Nixon when Gerald Ford became president ?
4,Where does the U.S. rank among world countries in area ?
4,What was the target rate for M3 growth in 1992 ?
OTHERS,What baseball team was routinely called `` dem bums '' by its frustrated fans ?
OTHERS,Name of scholar on whose literal translations from the Chinese and Japanese Ezra Pound depended ?
OTHERS,What are the major differences in the Catholic and Methodist religions ?
OTHERS,Name the On Stage character whose face was never seen .
4,How much energy is released when oxygen and hydrogen mix ?
OTHERS,What is the best Internet business to go into ?
OTHERS,What does Venus Retrograde mean ?
OTHERS,Who is known as `` the world 's oldest teenager '' ?
OTHERS,What does Las Vegas mean ?
OTHERS,What does the word `` meta '' mean ?
1,What keeps clouds in the air ?
1,What 's the term for any four-sided figure ?
1,Ray Charles plays which instrument ?
5,What country and western singer is known as The Silver Fox ?
5,What building appropriately enough is depicted on the back of the 1-dollar bill ?
OTHERS,What is graduate school ?
OTHERS,What is the difference between New York-style and Chicago-style pizza ?
OTHERS,What baseball team owner and sailor is known as The Mouth of the South ?
1,What kind of hat does Bat Masterson wear ?
OTHERS,Who was with Patricia Hearst the night she was kidnaped ?
OTHERS,What is the Viking Prince 's first name ?
2,What does the abbreviation cwt. ?
1,In what deodorant commercial did tenants have adjoining medicine cabinets ?
5,Where is Rider College located ?
OTHERS,What boxer 's life story is titled Raging Bull ?
OTHERS,For what reason did some San Diego schools stop serving apples ?
OTHERS,Who advised listeners to `` see the U.S.A. in your Chevrolet '' ?
5,Where was the first restaurant ?
5,Where can I find full written draft of CTBT ?
4,How many horses died during the civil war ?
4,How much waste does an average dairy cow produce in a day ?
OTHERS,What Nobel laureate was expelled from the Philippines before the conference on East Timor ?
OTHERS,"What woman has carried the most multiple births , twins , triplets , etc. , ?"
4,How many minutes were there on the original GE College Bowl clock ?
4,What is the average time it takes for a male to ejaculate ?
5,What is website of the International Court of Justice ?
5,Where can I look at a perpetual calendar ?
4,How many astronauts have been on the moon ?
4,In what year did the Bounty mutiny happen ?
1,What is the only substance that gives food its `` taste '' when eaten ?
OTHERS,How do you reference a website ?
OTHERS,What is pandoro ?
2,What do the letters ZIP stand for in the phrase `` ZIP code '' ?
OTHERS,Which Bourbon king was restored to the French throne during Napoleon 's abdication ?
5,What is one of the cities that the University of Minnesota is located in ?
OTHERS,What are the words to `` My Way '' written by Paul Anka ?
OTHERS,How do I install a tile floor ?
1,What is the quickest and easiest way to get nail polish out of clothes ?
OTHERS,Why was the zipper invented ?
1,What 's the No. 1 killer in industrialized countries ?
1,Name four famous cartoon cats .
OTHERS,What daughter of Henry VIII and Anne Boleyn became queen of England ?
OTHERS,How did ` stat ' come to be used as an expression for quickly ?
OTHERS,What 's the most common nickname of U.S. college football teams ?
OTHERS,What 's the distinction of U.S. Supreme Court Justice Thurgood Marshall ?
5,What is the world 's highest peak ?
OTHERS,What was a Mae West on a World War II battleship ?
OTHERS,Define cosmology .
OTHERS,What comedienne upstaged Dwight D. Eisenhower 's first inauguration by giving birth to her first child ?
OTHERS,What are amicable numbers ?
4,When were the Olympic Games in which Nadia Comaneci became popular played ?
5,"Where is Hearst Castle , built by publisher William Randolph Hearst ?"
5,What 's the largest U.S. city on the Great Lakes ?
OTHERS,Who sang about Desmond and Molly Jones ?
1,"What magazine gives us the cream , not the skim ?"
1,What does the technique called `` cold fusion '' produce ?
OTHERS,What costume designer decided that Michael Jackson should only wear one glove ?
1,"What meter did Shakespeare use in writing : `` To be , or not to be , that is the question.. . '' ?"
4,How many rows of sprocket holes does a roll of 35-millimeter film have ?
4,What is the goat population of the world ?
OTHERS,What company was the original sponsor of TV 's Superman ?
1,What term does a Czech use to describe a Pole ?
5,What sea separates Naples and Algiers ?
4,How many lawyers are there in the state of New Jersey ?
1,What are the most common elements in seawater ?
OTHERS,Describe the Finnish music personality Salonen 's appearance .
OTHERS,What is the origin of the ethnic category `` caucasian '' ?
1,What kind of science is cosmology ?
OTHERS,Name the blind sculptress in love with the Fantastic Four 's Thing .
1,What 's the second-lightest element ?
1,What do you call a `` twirl '' in ballet ?
1,What is the brand name of daminozide ?
OTHERS,What National Basketball Association superstar told his story in Giant Steps ?
1,What animals did The Amazing Three masquerade as ?
OTHERS,How did the bikini bathing suite get its name ?
4,When did Fraze get his first patent for the pull-tab can ?
4,How many games are played in a five-team round-robin tournament ?
OTHERS,Who developed the first polio vaccine ?
OTHERS,Who made the first gas engine ?
5,"What country claimed Rubens , Van Dyck and Bruegel as citizens ?"
1,What civil war was fought between 1936 and 1939 ?
4,How many questions do you have on your database ?
OTHERS,How do clouds form ?
5,Where can I find examples of legal cases about the Individuals with Disabilities Education Act ?
OTHERS,What character did Tex Avery first create upon arriving at MGM ?
OTHERS,What Asian spiritual and political leader was married at the age of 13 ?
5,Where is Ocho Rios ?
OTHERS,What is the half-life of P-32 ?
5,What ocean does Mauritania border ?
OTHERS,Why do pressure cookers save time in the kitchen ?
OTHERS,Why are there 12 people on a jury in criminal cases ?
OTHERS,What do Christian Scientists believe in ?
1,"What World War I battle saw 6 , 0 troops killed in one day ?"
5,What country is Kosovo a part of ?
1,What computer operating system is on the most computers ?
5,What is Bill Gross 's email address ?
OTHERS,What is the economic impact of unemployment on the economy ?
2,"What do the letters D.C. stand for in Washington , D.C. ?"
1,What animals can live the longest without food ?
OTHERS,What English queen had seventeen children ?
4,"What is the approximate population of Las Vegas , N.M ?"
4,How much does the President get paid ?
OTHERS,What two baseball players make up the battery ?
1,What 's the largest letter in Salvador Dali 's signature ?
1,What does an irate car owner call iron oxide ?
4,"Of children between the ages of two and eleven , what percentage watch `` The Simpsons '' ?"
5,What 's the northernmost U.S. state apart from Alaska ?
5,Name an art gallery in New York .
OTHERS,Who sells Viagra ?
OTHERS,What is the Home Rule Act ?
5,What building are British monarchs crowned in ?
OTHERS,What are Bellworts ?
OTHERS,Who was Darius ?
1,What movie told of Anna Anderson 's claim to be a Russian czar 's daughter ?
OTHERS,Who did Dita Beard work for ?
1,What kind of creature is a coot ?
OTHERS,Name the university of which Woodrow Wilson was president .
5,"What country was first to use the airplane as a weapon of war , against the Turks in Libya ?"
OTHERS,What university was Woodrow Wilson President of ?
1,What is a fear of disease ?
1,What kind of meat is Fray Bentos synonymous with ?
OTHERS,What are the words to the Canadian National anthem ?
1,What is the name of the Jewish alphabet ?
OTHERS,Who served as inspiration for the schoolteacher portrayed by Robin Williams in `` Dead Poets Society '' ?
4,What is Columbia Tristar 's phone number ?
OTHERS,Which one of the original seven Mercury program astronauts did not fly on any of the Mercury flights ?
OTHERS,Who is the best known villain of the 165 Gunpowder Plot ?
5,What is the capital of Burkina Faso ?
5,What continent is Bolivia on ?
OTHERS,Why was Muhammad Ali stripped of his title and barred from boxing in 1967 ?
OTHERS,"Who killed more people , Hitler or Stalin ?"
OTHERS,What caused Shea & Gould to close their L.A. office ?
1,What 's the only mammal that can 't jump ?
5,What U.S. state has the most blondes ?
1,What war saw battles at Parrot 's Beak and Black Virgin ?
4,What was the U.S. highway death toll in 1969 ?
OTHERS,What does the name Kelly mean ?
OTHERS,What is a phalanx ?
OTHERS,What mustachioed comedian portrayed Frankie in North to Alaska ?
4,What does each of the utilities cost in Monopoly ?
OTHERS,"What actor and World War II airman had a $5 , 0 bounty put on his head by Hermann Goering ?"
2,What does e.g. stand for ?
1,What is the name of the medical condition in which a baby is born without a brain ?
OTHERS,How do storms form ?
OTHERS,Who is Nicolo Paganini ?
5,What city is often called The Insurance Capital of the World ?
1,What are the three animals in Sheila Burnford 's The Incredible Journey ?
OTHERS,Who portrayed Dracula in Hammer Studios ' films ?
1,Name one of the Seven Wonders of the Ancient World .
4,When were fish first believed to be found on earth ?
OTHERS,"What President 's favorite Biblical quotation was : `` Come now , and let us reason together '' ."
OTHERS,Name the food company that traveled to Soviet Georgia to film a series of ads .
5,What country was Sir Edmund Hillary born in ?
1,What 's an infant seal called ?
OTHERS,"What was the proper Laugh-In respones to : `` Say goodnight , Dick '' ?"
4,How long does a dog sleep ?
1,What 1963 Joseph L. Mankiewicz film cost $28 million ?
OTHERS,What Japanese electronics company was named for a coastal city northeast of Tokyo ?
4,What can you be fined for having a dog on a beach ?
5,Where did the Battle of the Bulge take place ?
4,How much will the California be in the year 2000 ?
OTHERS,"What mystery writer penned `` ...the glory that was Greece , and the grandeur that was Rome '' ?"
1,Name Li 'l Abner 's favorite Indian drink .
1,What are some important events of the 1830 's ?
4,The Iraqis launched their attack on Kuwait on what day ?
1,"What did 8 , CD NNS VBP TO VB NNP POS NN ."
OTHERS,What is God ?
5,What country 's northernmost city is Darwin ?
5,"What sound does Olympia , Washington , overlook ?"
1,What TV show chronicled the lives of Katy Holstrum and Congressman Glen Morley ?
5,What Kentucky city calls itself The Horse Center of America ?
4,How many penny-farthings are there on a Trivial Pursuit game board ?
5,"What European country boasts the city of Furth , found where the rivers Rednitz and Pegnitz converge ?"
5,What U.S. state is Dixville Notch in ?
5,"Where was the Cisalpine Republic , 1797-185 , ?"
5,What is the largest shopping mall in the world ?
OTHERS,What is the protagonist 's name in Dostoevski 's `` The Idiot '' ?
1,What penalty space lies between Baltic Avenue and Reading Railroad on a Monopoly board ?
OTHERS,What presidential press secretary dismissed Watergate as a third-rate burglary attempt ?
OTHERS,What is a meerkat ?
OTHERS,Who was Jean Nicolet ?
1,What kind of animal was Winnie the Pooh ?
OTHERS,Which of these are authors ?
1,What 's the international radio code word for the letter B ?
OTHERS,Who was the original Humpty Dumpty ?
OTHERS,What is cache memory ?
1,Aspartame is also known as what ?
5,Where is the location of the Orange Bowl ?
4,When is President Nixon 's birthday ?
OTHERS,"What is the origin of the midwest slang , ` you 're darn tootin ' ?"
OTHERS,Whose cupboard was bare ?
5,What are the seven seas ?
OTHERS,What is the difference between jazz and blues ?
OTHERS,What is the C programming language ?
OTHERS,What 's the name of Popeye 's adopted son ?
OTHERS,Who invented the vacuum cleaner ?
OTHERS,What is a ` borrow pit ' ?
OTHERS,What 2th-century fictional character attends Pencey Prep School ?
4,How many people in the USA say their number one source of information is the newspaper ?
OTHERS,"Who does Shakespeare 's Antonio borrow 3 , 0 ducats from ?"
5,Which country is known as `` Big Bear '' ?
1,"What `` melts in your mouth , not in your hands '' ."
4,How many times a day should you take a prescription marked `` q.i.d . '' ?
OTHERS,What is the origin of the atom ?
OTHERS,What two commanders directed the forces in the Battle of El Alamein ?
OTHERS,Name the creator of `` The Muppets '' .
OTHERS,How do I e-mail someone at aol.com from yahoo.com ?
OTHERS,Who replies `` I know '' to Princess Leia 's confession `` I love you '' in The Empire Strikes Back ?
OTHERS,What is the meaning of the name Ella ?
5,What 's the home of the Rockettes ?
5,"Where can I find all the information I need to know about the English Civil War , 1642-1649 , ?"
OTHERS,What is the name of the firm that makes Spumante ?
1,What sport is played on the largest field ?
OTHERS,Who won the 1967 Academy Award for Best Actor ?
1,What is after death ?
OTHERS,Name the first private citizen to fly in space .
OTHERS,What was football star Elroy Hirsch 's nickname ?
OTHERS,What singer sings `` Oh Boy '' ?
5,What is the website for the USA journal ?
OTHERS,What army 's motto is Blood and Fire ?
1,What kind of patent did Ermal Fraze get in 1963 ?
OTHERS,What are you hearing when you put a seashell to your ear ?
1,Which gender has bigger thighs ?
5,What U.S. state has the second-longest coastline ?
5,What state 's home to the Buffalo Bill Historical Center ?
4,How fast do cheetahs run ?
1,What is Ray Bradbury 's illustrated man illustrated with ?
4,How fast is a 45Mhz processor ?
1,"What kind of puzzle first appeared in the U.S. in the New York World on December 21 , 1913 ?"
OTHERS,What count did Alexandre Dumas write about ?
4,What are the odds of giving birth to twins ?
5,What is the largest natural lake in Pennsylvania ?
4,How far is London UK from California ?
1,Name the two mystical ravens Odin has at his command .
1,What was the species of Winnie the Pooh ?
OTHERS,What is the virus HIV ?
1,What Hermann Hesse book gave its name to a rock group ?
1,What book is the follow-up to Future Shock ?
1,What African animals are known as The Big Five ?
1,What is the alphabet for Latin ?
1,What is the fear of frogs ?
5,Which city in Canada is the least-populated ?
4,How old is Stevie Wonder ?
OTHERS,Who is Luke Skywalker 's father ?
OTHERS,What is the definition of the term `` weapons system '' ?
OTHERS,What are Christopher Marlowe 's and Shakespeare 's literary contributions to English literature ?
1,What is Nero Wolfe 's favorite drink during office hours ?
OTHERS,What is the first personal computer company ?
1,What is the most efficient way to start a barbeque ?
OTHERS,Why are there Braille things on the ATM machines that people drive through ?
5,Where is the Isle of Man ?
1,What book did Aaron Hass write ?
4,What was the death toll at the eruption of Mount Pinatubo ?
4,When will the millennium officially begin ?
OTHERS,"Who created the comic strip , `` Garfield '' ?"
OTHERS,Which Vietnamese terrorist is now a UN delegate in Doonesbury ?
OTHERS,What is real time processing ?
5,What do we call the imaginary line along the top of the Rocky Mountains ?
5,What country 's capital is Lagos ?
5,Where does Ray Bradbury 's Chronicles take place ?
OTHERS,Who is the current prime minister and president of Russia ?
OTHERS,Who established a Viking colony in Greenland about 985 ?
1,What was the distinguishing mark on the `` Little Rascals '' dog ?
4,"What is the latitude and longitude of El Paso , Texas ?"
5,Where did Honecker rule ?
OTHERS,What is the theory of equivalence states ?
1,What does a philatelist collect ?
4,What is the life span of the average monkey ?
4,How many member states are in the UN ?
OTHERS,Who shot and killed himself while painting Wheatfield with Crows ?
OTHERS,What will happen when sodium is put in water ?
OTHERS,What future President became Senate majority whip under Harry Truman ?
OTHERS,Who was the architect of Central Park ?
1,Which operating system runs on IBM-compatible machines ?
4,What are the dimensions of an ice hockey goal ?
4,When was CNN 's first broadcast ?
1,What are the signs of a country going into a recession ?
OTHERS,What is the circumorbital hematoma ?
5,What African country is governed from Ouagadougou ?
OTHERS,What was the Christian name of the title character in Our Miss Brooks ?
OTHERS,What hard-of hearing artist painted Sunflowers ?
